[
  {
    "id": "computer-science",
    "name": "Computer Science and Engineering",
    "aliases": [
      "B.Tech.(Computer Scienceand",
      "B.Techin CSE(AIand ML)",
      "B.TechinCSE(AIand ML)",
      "CSE",
      "Computer Engineering",
      "Computer Sc. and Engg.",
      "Computer Science",
      "Computer Science & Engineering",
      "Computer Science (4 Years, Bachelor of Technology)",
      "Computer Science Engineering",
      "Computer Science Engineering (Artificial Intelligence)",
      "Computer Science Engineering (Artificiallntelligenceand Machine Learning)",
      "Computer Science Engineering (Data Science and Analytics)",
      "Computer Science Engineering (Data Science)",
      "Computer Science Engineering (Human Computerlnteraction and Gaming Technology)",
      "Computer Science Engineering(Artificial Intelligence)",
      "Computer Science Engineering(Artificial lntelligence and Machine Learning)",
      "Computer Science Engineering(Artificial lntelligenceand Machine Learning)",
      "Computer Science Engineering(Data",
      "Computer Science Engineering(Data Science and Analytics)",
      "Computer Science Engineering(Data Science)",
      "Computer Science Engineering(Human Computerlnteraction and Gaming",
      "Computer Science Engineering(Human Computerlnteractionand Gaming Technology)",
      "Computer Science and Engg",
      "Computer Scienceand Engineering(Cyber",
      "Computer Scienceand Engineering(Cyber Physical System)",
      "Computer Scienceand Engineering(Data",
      "Computer Scienceand Engineering(Internet of Things,Cyber Securityincluding Block Chain",
      "Computer Scienceand Engineeringwith Majorin Artificial",
      "Computer Scienceand Engineeringwith Specializationin Cyber Security",
      "Computer Scienceand Engineeringwith Specializationin Data",
      "Computer Scienceand Engineeringwith Specializationin Data Science",
      "Computer Scienceand Engineeringwith minorin AIand ML",
      "Computer Scienceand Engineeringwith specializationin Cyber Security",
      "Computer Scienceand Engineeringwith specializationin Quantum",
      "ComputerEngineering",
      "ComputerScience Engineering(Artificial Intelligence)",
      "ComputerScience Engineering(Artificial lntelligenceand MachineLearning)",
      "ComputerScience Engineering(Artificial lntelligenceandMachine Learning)",
      "ComputerScience Engineering(Data",
      "ComputerScience Engineering(Data Science)",
      "ComputerScience Engineering(Data ScienceandAnalytics)",
      "ComputerScience Engineering(Human Computerlnteraction andGaming",
      "ComputerScience Engineering(Human Computerlnteractionand GamingTechnology)",
      "ComputerScienceEngineering (ArtificialIntelligence)",
      "ComputerScienceEngineering (Artificiallntelligenceand MachineLearning)",
      "ComputerScienceEngineering (DataScience)",
      "ComputerScienceEngineering (DataScienceandAnalytics)",
      "ComputerScienceEngineering (HumanComputerlnteraction andGamingTechnology)",
      "ComputerScienceand Engineering(Cyber",
      "ComputerScienceand Engineering(Cyber PhysicalSystem)",
      "ComputerScienceand Engineering(Data",
      "ComputerScienceand Engineering(Internet ofThings,Cyber Securityincluding BlockChain",
      "ComputerScienceand Engineeringwith MajorinArtificial",
      "ComputerScienceand Engineeringwith SpecializationinCyber Security",
      "ComputerScienceand Engineeringwith SpecializationinData",
      "ComputerScienceand Engineeringwith SpecializationinData Science",
      "ComputerScienceand Engineeringwith minorinAIandML",
      "ComputerScienceand Engineeringwith specializationin Quantum",
      "ComputerScienceand Engineeringwith specializationinCyber Security",
      "Integrated B.Tech.-M. Techin Computer Science& Engineering",
      "IntegratedB.Tech.-M. TechinComputerScience& Engineering"
    ],
    "degree": "B.Tech",
    "duration_years": 4
  },
  {
    "id": "electrical",
    "name": "Electrical Engineering",
    "aliases": [
      "B.Techin Electrical Engineering(Rail Engineering)",
      "B.TechinElectrical Engineering(Rail Engineering)",
      "EE",
      "Electrical Engg",
      "Electrical Engg.",
      "Electrical Engineering with Specialization In Power System",
      "Electrical Engineeringwith Specialization In Power System Engineering",
      "ElectricalEngineering withSpecializationIn PowerSystem",
      "ElectricalEngineeringwith SpecializationInPower SystemEngineering",
      "Integrated B.Tech.-M. Techin Electrical Engineering",
      "IntegratedB.Tech.-M. TechinElectrical Engineering"
    ],
    "degree": "B.Tech",
    "duration_years": 4
  },
  {
    "id": "electronics-communication",
    "name": "Electronics and Communication Engineering",
    "aliases": [
      "B.Tech.(Electronics and Communication Engineering)-MBA",
      "B.Tech.(Electronics andCommunication Engineering)-MBA",
      "B.Tech.in Electronics and Communication Engineeringand M.Tech.in",
      "B.Tech.in Electronics and Communication Engineeringand M.Tech.in Microelectronicsand",
      "B.Tech.in Electronicsand Communication Engineering and M.Tech.in VLSIDesign",
      "B.Tech.inElectronics andCommunication Engineeringand M.Tech.in",
      "B.Tech.inElectronics andCommunication Engineeringand M.Tech.in Microelectronicsand",
      "B.Tech.inElectronicsand CommunicationEngineering andM.Tech.inVLSIDesign",
      "B.Techin Electronics &Communication Engineering(Rail",
      "B.Techin Electronics and Communication Engineeringwith minorin Wearable",
      "B.TechinElectronics &Communication Engineering(Rail",
      "B.TechinElectronics andCommunication Engineeringwith minorinWearable",
      "ECE",
      "Electronics & Communication",
      "Electronics & Communication Engineering",
      "Electronics and Communication",
      "Electronics and Communication Engineering(Avionics)",
      "Electronics and Communication Engineering(Internetof Things)",
      "Electronics and Communication Engineering(with Specialization of Embedded Systemsand Internetof Things)",
      "Electronics and Electrical Communication Engineering",
      "Electronics and Electrical Communication Engineering (4 Years, Bachelor of Technology)",
      "Electronicsand Communication Engineering (Avionics)",
      "Electronicsand Communication Engineering (Internetof Things)",
      "Electronicsand Communication Engineering (with Specializationof Embedded Systemsand Internetof Things)",
      "Electronicsand Communication Engineering with Specializationin Microelectronics and VLSI System Design",
      "Electronicsand Communication Engineering withspecializationin Design and Manufacturing",
      "Electronicsand Communication Engineering withspecializationin VLSI and Embedded Systems",
      "Electronicsand Communication Engineering(Avionics)",
      "Electronicsand Communication Engineering(Internet",
      "Electronicsand Communication Engineering(VLSI",
      "Electronicsand Communication Engineering(with Specializationof Embedded Systems",
      "Electronicsand Communication Engineering(with Specializationof EmbeddedSystems",
      "Electronicsand Communication Engineeringwith Specializationin Microelectronicsand",
      "Electronicsand Communication Engineeringwith specializationin",
      "Electronicsand Communication Engineeringwith specializationin VLSI",
      "Electronicsand Communication Engineeringwith specializationinVLSI",
      "Electronicsand CommunicationEngineering (Avionics)",
      "Electronicsand CommunicationEngineering (InternetofThings)",
      "Electronicsand CommunicationEngineering (withSpecializationof EmbeddedSystemsand InternetofThings)",
      "Electronicsand CommunicationEngineering withSpecializationin MicroelectronicsandVLSI SystemDesign",
      "Electronicsand CommunicationEngineering withspecializationinDesign andManufacturing",
      "Electronicsand CommunicationEngineering withspecializationinVLSI andEmbeddedSystems",
      "Electronicsand Telecommunication Engineering",
      "ElectronicsandCommunication Engineering(Avionics)",
      "ElectronicsandCommunication Engineering(InternetofThings)",
      "ElectronicsandCommunication Engineering(withSpecialization ofEmbeddedSystemsand InternetofThings)"
    ],
    "degree": "B.Tech",
    "duration_years": 4
  },
  {
    "id": "mechanical",
    "name": "Mechanical Engineering",
    "aliases": [
      "B.Tech.(Mechanical Engineering)-MBA",
      "B.Techin Mechanical Engineering and M.Techin AIand Robotics",
      "B.Techin Mechanical Engineering(Rail Engineering)",
      "B.Techin Mechanical Engineeringand M.Techin AIand",
      "B.TechinMechanical Engineering(Rail Engineering)",
      "B.TechinMechanical Engineeringand M.TechinAIand",
      "B.TechinMechanical EngineeringandM.Techin AIandRobotics",
      "ME",
      "Mech",
      "Mechanical Engg",
      "Mechanical Engg.",
      "Mechanical Engineering with Specializationin Manufacturingand Industrial Engineering",
      "Mechanical Engineering withspecializationin Design and Manufacturing",
      "Mechanical Engineeringwith Specializationin Manufacturing and Industrial Engineering",
      "Mechanical Engineeringwith Specializationin Manufacturingand",
      "Mechanical Engineeringwith specializationin Designand",
      "Mechanical Engineeringwith specializationin Designand Manufacturing",
      "MechanicalEngineering withSpecializationin Manufacturingand IndustrialEngineering",
      "MechanicalEngineering withspecializationinDesign andManufacturing",
      "MechanicalEngineeringwith SpecializationinManufacturing andIndustrialEngineering",
      "MechanicalEngineeringwith specializationinDesignand Manufacturing",
      "Mechatronics Engineering",
      "Mechatronicsand Automation",
      "Mechatronicsand Automation Engineering",
      "Mechatronicsand AutomationEngineering"
    ],
    "degree": "B.Tech",
    "duration_years": 4
  },
  {
    "id": "civil",
    "name": "Civil Engineering",
    "aliases": [